<?xml version="1.0"?>
<!DOCTYPE HPCToolkitExperiment [
<!-- ******************************************************************** -->
<!-- HPCToolkit Experiment DTD						  -->
<!-- Version 2.1							  -->
<!-- ******************************************************************** -->
<!ELEMENT HPCToolkitExperiment (Header, (SecCallPathProfile|SecFlatProfile)*)>
<!ATTLIST HPCToolkitExperiment
	  version CDATA #REQUIRED>

  <!-- ****************************************************************** -->

  <!-- Info/NV: flexible name-value pairs: (n)ame; (t)ype; (v)alue -->
  <!ELEMENT Info (NV*)>
  <!ATTLIST Info
	    n CDATA #IMPLIED>
  <!ELEMENT NV EMPTY>
  <!ATTLIST NV
	    n CDATA #REQUIRED
	    t CDATA #IMPLIED
	    v CDATA #REQUIRED>

  <!-- ****************************************************************** -->
  <!-- Header								  -->
  <!-- ****************************************************************** -->
  <!ELEMENT Header (Info*)>
  <!ATTLIST Header
	    n CDATA #REQUIRED>

  <!-- ****************************************************************** -->
  <!-- Section Header							  -->
  <!-- ****************************************************************** -->
  <!ELEMENT SecHeader (MetricTable?, MetricDBTable?, TraceDBTable?, LoadModuleTable?, FileTable?, ProcedureTable?, Info*)>

    <!-- MetricTable: -->
    <!ELEMENT MetricTable (Metric)*>

    <!-- Metric: (i)d; (n)ame -->
    <!--   (v)alue-type: transient type of values -->
    <!--   (t)ype: persistent type of metric -->
    <!--   fmt: format; show; -->
    <!ELEMENT Metric (MetricFormula*, Info?)>
    <!ATTLIST Metric
	      i            CDATA #REQUIRED
	      n            CDATA #REQUIRED
	      es	   CDATA #IMPLIED
	      em	   CDATA #IMPLIED
	      ep	   CDATA #IMPLIED
	      v            (raw|final|derived-incr|derived) "raw"
	      t            (inclusive|exclusive|nil) "nil"
	      partner      CDATA #IMPLIED
	      fmt          CDATA #IMPLIED
	      show         (1|0) "1"
	      show-percent (1|0) "1">

    <!-- MetricFormula represents derived metrics: (t)ype; (frm): formula -->
    <!ELEMENT MetricFormula (Info?)>
    <!ATTLIST MetricFormula
	      t   (combine|finalize) "finalize"
	      i   CDATA #IMPLIED
	      frm CDATA #REQUIRED>

    <!-- Metric data, used in sections: (n)ame [from Metric]; (v)alue -->
    <!ELEMENT M EMPTY>
    <!ATTLIST M
	      n CDATA #REQUIRED
	      v CDATA #REQUIRED>

    <!-- MetricDBTable: -->
    <!ELEMENT MetricDBTable (MetricDB)*>

    <!-- MetricDB: (i)d; (n)ame -->
    <!--   (t)ype: persistent type of metric -->
    <!--   db-glob:        file glob describing files in metric db -->
    <!--   db-id:          id within metric db -->
    <!--   db-num-metrics: number of metrics in db -->
    <!--   db-header-sz:   size (in bytes) of a db file header -->
    <!ELEMENT MetricDB EMPTY>
    <!ATTLIST MetricDB
	      i              CDATA #REQUIRED
	      n              CDATA #REQUIRED
	      t              (inclusive|exclusive|nil) "nil"
	      partner        CDATA #IMPLIED
	      db-glob        CDATA #IMPLIED
	      db-id          CDATA #IMPLIED
	      db-num-metrics CDATA #IMPLIED
	      db-header-sz   CDATA #IMPLIED>

    <!-- TraceDBTable: -->
    <!ELEMENT TraceDBTable (TraceDB)>

    <!-- TraceDB: (i)d -->
    <!--   db-min-time: min beginning time stamp (global) -->
    <!--   db-max-time: max ending time stamp (global) -->
    <!ELEMENT TraceDB EMPTY>
    <!ATTLIST TraceDB
	      i            CDATA #REQUIRED
	      db-glob      CDATA #IMPLIED
	      db-min-time  CDATA #IMPLIED
	      db-max-time  CDATA #IMPLIED
	      db-header-sz CDATA #IMPLIED>

    <!-- LoadModuleTable assigns a short name to a load module -->
    <!ELEMENT LoadModuleTable (LoadModule)*>

    <!ELEMENT LoadModule (Info?)>
    <!ATTLIST LoadModule
	      i CDATA #REQUIRED
	      n CDATA #REQUIRED>

    <!-- FileTable assigns a short name to a file -->
    <!ELEMENT FileTable (File)*>

    <!ELEMENT File (Info?)>
    <!ATTLIST File
	      i CDATA #REQUIRED
	      n CDATA #REQUIRED>

    <!-- ProcedureTable assigns a short name to a procedure -->
    <!ELEMENT ProcedureTable (Procedure)*>

    <!ELEMENT Procedure (Info?)>
    <!ATTLIST Procedure
	      i CDATA #REQUIRED
	      n CDATA #REQUIRED>

  <!-- ****************************************************************** -->
  <!-- Section: Call path profile					  -->
  <!-- ****************************************************************** -->
  <!ELEMENT SecCallPathProfile (SecHeader, SecCallPathProfileData)>
  <!ATTLIST SecCallPathProfile
	    i CDATA #REQUIRED
	    n CDATA #REQUIRED>

    <!ELEMENT SecCallPathProfileData (PF|M)*>
      <!-- Procedure frame -->
      <!--   (i)d: unique identifier for cross referencing -->
      <!--   (s)tatic scope id -->
      <!--   (n)ame: a string or an id in ProcedureTable -->
      <!--   (lm) load module: a string or an id in LoadModuleTable -->
      <!--   (f)ile name: a string or an id in LoadModuleTable -->
      <!--   (l)ine range: "beg-end" (inclusive range) -->
      <!--   (a)lien: whether frame is alien to enclosing P -->
      <!--   (str)uct: hpcstruct node id -->
      <!--   (v)ma-range-set: "{[beg-end), [beg-end)...}" -->
      <!ELEMENT PF (PF|Pr|L|C|S|M)*>
      <!ATTLIST PF
		i  CDATA #IMPLIED
		s  CDATA #IMPLIED
		n  CDATA #REQUIRED
		lm CDATA #IMPLIED
		f  CDATA #IMPLIED
		l  CDATA #IMPLIED
		str  CDATA #IMPLIED
		v  CDATA #IMPLIED>
      <!-- Procedure (static): GOAL: replace with 'P' -->
      <!ELEMENT Pr (Pr|L|C|S|M)*>
      <!ATTLIST Pr
                i  CDATA #IMPLIED
		s  CDATA #IMPLIED
                n  CDATA #REQUIRED
		lm CDATA #IMPLIED
		f  CDATA #IMPLIED
                l  CDATA #IMPLIED
		a  (1|0) "0"
		str  CDATA #IMPLIED
		v  CDATA #IMPLIED>
      <!-- Callsite (a special StatementRange) -->
      <!ELEMENT C (PF|M)*>
      <!ATTLIST C
		i CDATA #IMPLIED
		s CDATA #IMPLIED
		l CDATA #IMPLIED
		str CDATA #IMPLIED
		v CDATA #IMPLIED>

  <!-- ****************************************************************** -->
  <!-- Section: Flat profile						  -->
  <!-- ****************************************************************** -->
  <!ELEMENT SecFlatProfile (SecHeader, SecFlatProfileData)>
  <!ATTLIST SecFlatProfile
	    i CDATA #REQUIRED
	    n CDATA #REQUIRED>

    <!ELEMENT SecFlatProfileData (LM|M)*>
      <!-- Load module: (i)d; (n)ame; (v)ma-range-set -->
      <!ELEMENT LM (F|P|M)*>
      <!ATTLIST LM
                i CDATA #IMPLIED
                n CDATA #REQUIRED
		v CDATA #IMPLIED>
      <!-- File -->
      <!ELEMENT F (P|L|S|M)*>
      <!ATTLIST F
                i CDATA #IMPLIED
                n CDATA #REQUIRED>
      <!-- Procedure (Note 1) -->
      <!ELEMENT P (P|A|L|S|C|M)*>
      <!ATTLIST P
                i CDATA #IMPLIED
                n CDATA #REQUIRED
                l CDATA #IMPLIED
		str CDATA #IMPLIED
		v CDATA #IMPLIED>
      <!-- Alien (Note 1) -->
      <!ELEMENT A (A|L|S|C|M)*>
      <!ATTLIST A
                i CDATA #IMPLIED
                f CDATA #IMPLIED
                n CDATA #IMPLIED
                l CDATA #IMPLIED
		str CDATA #IMPLIED
		v CDATA #IMPLIED>
      <!-- Loop (Note 1,2) -->
      <!ELEMENT L (A|Pr|L|S|C|M)*>
      <!ATTLIST L
		i CDATA #IMPLIED
		s CDATA #IMPLIED
		l CDATA #IMPLIED
	        f CDATA #IMPLIED
		str CDATA #IMPLIED
		v CDATA #IMPLIED>
      <!-- Statement (Note 2) -->
      <!--   (it): trace record identifier -->
      <!ELEMENT S (S|M)*>
      <!ATTLIST S
		i  CDATA #IMPLIED
		it CDATA #IMPLIED
		s  CDATA #IMPLIED
		l  CDATA #IMPLIED
		str  CDATA #IMPLIED
		v  CDATA #IMPLIED>
      <!-- Note 1: Contained Cs may not contain PFs -->
      <!-- Note 2: The 's' attribute is not used for flat profiles -->
]>
<HPCToolkitExperiment version="2.1">
<Header n="simulation">
  <Info/>
</Header>
<SecCallPathProfile i="0" n="simulation">
<SecHeader>
  <MetricTable>
    <Metric i="70" n="CPUTIME (usec):Sum (I)" v="derived-incr" em="0" es="0" ep="0" t="inclusive" partner="71" show="1" show-percent="1">
      <MetricFormula t="combine" frm="sum($70, $70)"/>
      <MetricFormula t="finalize" frm="$70"/>
      <Info><NV n="units" v="events"/></Info>
    </Metric>
    <Metric i="71" n="CPUTIME (usec):Sum (E)" v="derived-incr" em="0" es="0" ep="0" t="exclusive" partner="70" show="1" show-percent="1">
      <MetricFormula t="combine" frm="sum($71, $71)"/>
      <MetricFormula t="finalize" frm="$71"/>
      <Info><NV n="units" v="events"/></Info>
    </Metric>
  </MetricTable>
  <MetricDBTable>
  </MetricDBTable>
  <TraceDBTable>
    <TraceDB i="0" db-glob="*.hpctrace" db-min-time="1623993968083371" db-max-time="1623993969165426" db-header-sz="32"/>
  </TraceDBTable>
  <LoadModuleTable>
    <LoadModule i="2" n="/gpfs/wolf/gen159/proj-shared/MFC/spencer/MFC-develop/src/simulation_code/simulation"/>
    <LoadModule i="13748" n="&lt;unknown load module&gt;"/>
    <LoadModule i="13754" n="/autofs/nccsopen-svm1_sw/ascent/hpctoolkit/linux-rhel7-ppc64le/gcc-8.1.1/hpctoolkit-gpu-ag6t6wbs2wve5qhtiup2ukvjehgsipyr/lib/hpctoolkit/libhpcrun.so.0.0.0"/>
    <LoadModule i="13758" n="/autofs/nccsopen-svm1_sw/ascent/hpctoolkit/linux-rhel7-ppc64le/gcc-8.1.1/hpctoolkit-gpu-ag6t6wbs2wve5qhtiup2ukvjehgsipyr/lib/hpctoolkit/ext-libs/libmonitor.so.0.0.0"/>
    <LoadModule i="13772" n="/autofs/nccsopen-svm1_sw/ascent/.swci/1-compute/opt/spack/20180914/linux-rhel7-ppc64le/pgi-19.9/spectrum-mpi-10.3.1.2-20200121-zy6l7p3w4q2ns7i2zutzng7ex3drw656/lib/libpami_cudahook.so.1.0"/>
    <LoadModule i="13776" n="/usr/lib64/libpthread-2.17.so"/>
    <LoadModule i="13790" n="/autofs/nccsopen-svm1_sw/ascent/.swci/1-compute/opt/spack/20180914/linux-rhel7-ppc64le/pgi-19.9/spectrum-mpi-10.3.1.2-20200121-zy6l7p3w4q2ns7i2zutzng7ex3drw656/lib/libmpi_ibm_mpifh.so.3.1.0"/>
    <LoadModule i="13798" n="/autofs/nccsopen-svm1_sw/ascent/.swci/1-compute/opt/spack/20180914/linux-rhel7-ppc64le/pgi-19.9/spectrum-mpi-10.3.1.2-20200121-zy6l7p3w4q2ns7i2zutzng7ex3drw656/lib/libmpi_ibm.so.3.1.0"/>
    <LoadModule i="13812" n="/autofs/nccsopen-svm1_sw/ascent/.swci/0-core/opt/spack/20180914/linux-rhel7-ppc64le/gcc-4.8.5/pgi-19.9-6rlh73dtf3lmbm6v7r3fkh7tnbeq53hc/linuxpower/19.9/lib/libaccg.so"/>
    <LoadModule i="13855" n="/autofs/nccsopen-svm1_sw/ascent/.swci/0-core/opt/spack/20180914/linux-rhel7-ppc64le/gcc-4.8.5/pgi-19.9-6rlh73dtf3lmbm6v7r3fkh7tnbeq53hc/linuxpower/19.9/lib/libaccn.so"/>
    <LoadModule i="13879" n="/autofs/nccsopen-svm1_sw/ascent/.swci/0-core/opt/spack/20180914/linux-rhel7-ppc64le/gcc-4.8.5/pgi-19.9-6rlh73dtf3lmbm6v7r3fkh7tnbeq53hc/linuxpower/19.9/lib/libaccg2.so"/>
    <LoadModule i="13887" n="/autofs/nccsopen-svm1_sw/ascent/.swci/0-core/opt/spack/20180914/linux-rhel7-ppc64le/gcc-4.8.5/pgi-19.9-6rlh73dtf3lmbm6v7r3fkh7tnbeq53hc/linuxpower/19.9/lib/libpgf90.so"/>
    <LoadModule i="13894" n="/autofs/nccsopen-svm1_sw/ascent/.swci/0-core/opt/spack/20180914/linux-rhel7-ppc64le/gcc-4.8.5/pgi-19.9-6rlh73dtf3lmbm6v7r3fkh7tnbeq53hc/linuxpower/19.9/lib/libpgc.so"/>
    <LoadModule i="13898" n="/usr/lib64/libc-2.17.so"/>
    <LoadModule i="13969" n="/autofs/nccsopen-svm1_sw/ascent/.swci/1-compute/opt/spack/20180914/linux-rhel7-ppc64le/pgi-19.9/spectrum-mpi-10.3.1.2-20200121-zy6l7p3w4q2ns7i2zutzng7ex3drw656/lib/libopen-pal.so.3.1.0"/>
    <LoadModule i="14008" n="/autofs/nccsopen-svm1_sw/ascent/.swci/1-compute/opt/spack/20180914/linux-rhel7-ppc64le/pgi-19.9/spectrum-mpi-10.3.1.2-20200121-zy6l7p3w4q2ns7i2zutzng7ex3drw656/lib/spectrum_mpi/mca_pml_pami.so"/>
    <LoadModule i="14014" n="/autofs/nccsopen-svm1_sw/ascent/.swci/1-compute/opt/spack/20180914/linux-rhel7-ppc64le/pgi-19.9/spectrum-mpi-10.3.1.2-20200121-zy6l7p3w4q2ns7i2zutzng7ex3drw656/lib/pami_port/libpami.so.3.1.0"/>
    <LoadModule i="14034" n="/autofs/nccsopen-svm1_sw/ascent/.swci/1-compute/opt/spack/20180914/linux-rhel7-ppc64le/pgi-19.9/spectrum-mpi-10.3.1.2-20200121-zy6l7p3w4q2ns7i2zutzng7ex3drw656/lib/libmca_common_pami.so.3.1.0"/>
    <LoadModule i="14038" n="/usr/lib64/libibverbs.so.1.0.0"/>
    <LoadModule i="14044" n="/autofs/nccsopen-svm1_sw/ascent/.swci/1-compute/opt/spack/20180914/linux-rhel7-ppc64le/pgi-19.9/spectrum-mpi-10.3.1.2-20200121-zy6l7p3w4q2ns7i2zutzng7ex3drw656/lib/spectrum_mpi/mca_coll_ibm.so"/>
    <LoadModule i="14048" n="/usr/lib64/libmlx5.so.1.0.0"/>
    <LoadModule i="14068" n="/usr/lib64/libcuda.so.418.116.00"/>
  </LoadModuleTable>
  <FileTable>
    <File i="4189" n="./src/gpfs/wolf/gen159/proj-shared/MFC/spencer/MFC-develop/src/simulation_code/m_global_parameters.f90"/>
    <File i="5134" n="./src/gpfs/wolf/gen159/proj-shared/MFC/spencer/MFC-develop/src/simulation_code/m_mpi_proxy.f90"/>
    <File i="6260" n="./src/gpfs/wolf/gen159/proj-shared/MFC/spencer/MFC-develop/src/simulation_code/m_rhs.f90"/>
    <File i="6979" n="./src/gpfs/wolf/gen159/proj-shared/MFC/spencer/MFC-develop/src/simulation_code/m_riemann_solvers.f90"/>
    <File i="7141" n="./src/gpfs/wolf/gen159/proj-shared/MFC/spencer/MFC-develop/src/simulation_code/m_start_up.f90"/>
    <File i="8680" n="./src/gpfs/wolf/gen159/proj-shared/MFC/spencer/MFC-develop/src/simulation_code/m_time_steppers.f90"/>
    <File i="12595" n="./src/gpfs/wolf/gen159/proj-shared/MFC/spencer/MFC-develop/src/simulation_code/m_variables_conversion.f90"/>
    <File i="12964" n="./src/gpfs/wolf/gen159/proj-shared/MFC/spencer/MFC-develop/src/simulation_code/m_weno.f90"/>
    <File i="13278" n="./src/gpfs/wolf/gen159/proj-shared/MFC/spencer/MFC-develop/src/simulation_code/p_main.f90"/>
    <File i="13432" n="/proj/build/19B/linuxpower/rte/f90/f90/lib-linuxpower/../src-fio/f90main.c"/>
    <File i="13446" n="&lt;unknown file&gt; [simulation]"/>
    <File i="13749" n="&lt;unknown file&gt;"/>
    <File i="13755" n="&lt;unknown file&gt; [libhpcrun.so.0.0.0]"/>
    <File i="13759" n="&lt;unknown file&gt; [libmonitor.so.0.0.0]"/>
    <File i="13773" n="&lt;unknown file&gt; [libpami_cudahook.so.1.0]"/>
    <File i="13777" n="&lt;unknown file&gt; [libpthread-2.17.so]"/>
    <File i="13791" n="&lt;unknown file&gt; [libmpi_ibm_mpifh.so.3.1.0]"/>
    <File i="13799" n="&lt;unknown file&gt; [libmpi_ibm.so.3.1.0]"/>
    <File i="13813" n="&lt;unknown file&gt; [libaccg.so]"/>
    <File i="13840" n="create.c"/>
    <File i="13856" n="&lt;unknown file&gt; [libaccn.so]"/>
    <File i="13880" n="&lt;unknown file&gt; [libaccg2.so]"/>
    <File i="13888" n="/proj/build/19B/linuxpower/rte/f90/f90/lib-linuxpower-pic/../src/allo_i8.c"/>
    <File i="13891" n="/proj/build/19B/linuxpower/rte/f90/f90/lib-linuxpower-pic/../src/malloc.c"/>
    <File i="13895" n="&lt;unknown file&gt; [libpgc.so]"/>
    <File i="13899" n="&lt;unknown file&gt; [libc-2.17.so]"/>
    <File i="13952" n="malloc.c"/>
    <File i="13970" n="&lt;unknown file&gt; [libopen-pal.so.3.1.0]"/>
    <File i="13975" n="memory_patcher_component.c"/>
    <File i="14009" n="&lt;unknown file&gt; [mca_pml_pami.so]"/>
    <File i="14015" n="&lt;unknown file&gt; [libpami.so.3.1.0]"/>
    <File i="14035" n="&lt;unknown file&gt; [libmca_common_pami.so.3.1.0]"/>
    <File i="14039" n="&lt;unknown file&gt; [libibverbs.so.1.0.0]"/>
    <File i="14045" n="coll_ibm_component.c"/>
    <File i="14049" n="&lt;unknown file&gt; [libmlx5.so.1.0.0]"/>
    <File i="14069" n="&lt;unknown file&gt; [libcuda.so.418.116.00]"/>
  </FileTable>
  <ProcedureTable>
    <Procedure i="4311" n="m_global_parameters_s_initialize_global_parameters_module_" v="0x1003b788"/>
    <Procedure i="5496" n="m_mpi_proxy_s_mpi_sendrecv_grid_variables_buffers_" v="0x10049968"/>
    <Procedure i="5576" n="m_mpi_proxy_s_mpi_sendrecv_conservative_variables_buffers_" v="0x1004a948"/>
    <Procedure i="5727" n="m_mpi_proxy_s_mpi_finalize_" v="0x1004c088"/>
    <Procedure i="6328" n="m_rhs_s_alt_rhs_" v="0x1004e148"/>
    <Procedure i="6527" n="m_rhs_s_populate_conservative_variables_buffers_" v="0x10051618"/>
    <Procedure i="6567" n="m_rhs_s_mpi_sendrecv_conservative_variables_buffers_acc_" v="0x10051f38"/>
    <Procedure i="6730" n="m_rhs_s_populate_variables_buffers_" v="0x10055a08"/>
    <Procedure i="6980" n="m_riemann_solvers_s_initialize_riemann_solvers_module_" v="0x100377a8"/>
    <Procedure i="7068" n="m_riemann_solvers_s_hllc_riemann_solver_" v="0x100391b8"/>
    <Procedure i="8008" n="m_start_up_s_read_serial_data_files_" v="0x1000a068"/>
    <Procedure i="8538" n="m_start_up_s_populate_grid_variables_buffers_" v="0x10010038"/>
    <Procedure i="8957" n="m_time_steppers_s_1st_order_tvd_rk_" v="0x1007a5f8"/>
    <Procedure i="12682" n="m_variables_conversion_s_convert_conservative_to_primitive_variables_acc_" v="0x100139e8"/>
    <Procedure i="12965" n="m_weno_s_initialize_weno_module_" v="0x100700a8"/>
    <Procedure i="13072" n="m_weno_s_weno_alt_" v="0x10072328"/>
    <Procedure i="13127" n="m_weno_s_compute_weno_coefficients_" v="0x10073ac8"/>
    <Procedure i="13279" n="p_main" v="0x10046538"/>
    <Procedure i="13433" n="main" v="0x10003918"/>
    <Procedure i="13458" n="pgf90io_fmtw_end@plt" v="0x10002f60"/>
    <Procedure i="13498" n="pgf90_ptrchk@plt" v="0x100030a0"/>
    <Procedure i="13750" n="&lt;partial call paths&gt;" f="1" v="0"/>
    <Procedure i="13752" n="&lt;unknown procedure&gt;" v="0"/>
    <Procedure i="13756" n="&lt;no thread&gt;" v="0"/>
    <Procedure i="13760" n="&lt;program root&gt;" f="1" v="0"/>
    <Procedure i="13768" n="mpi_finalize_" v="0"/>
    <Procedure i="13770" n="PMPI_Finalize" v="0"/>
    <Procedure i="13774" n="cuMemHostAlloc" v="0"/>
    <Procedure i="13778" n="__GI___pthread_rwlock_unlock" v="0"/>
    <Procedure i="13780" n="__close_nocancel" v="0"/>
    <Procedure i="13782" n="pthread_spin_lock" v="0"/>
    <Procedure i="13784" n="__GI___pthread_rwlock_rdlock" v="0"/>
    <Procedure i="13786" n="__GI___pthread_once" v="0"/>
    <Procedure i="13788" n="__write_nocancel" v="0"/>
    <Procedure i="13794" n="PMPI_Sendrecv_f08" v="0"/>
    <Procedure i="13796" n="mpi_finalize__" v="0"/>
    <Procedure i="13804" n="PMPI_Sendrecv" v="0"/>
    <Procedure i="13806" n="ompi_request_default_wait" v="0"/>
    <Procedure i="13808" n="PMPI_Finalize" v="0"/>
    <Procedure i="13810" n="ompi_mpi_finalize" v="0"/>
    <Procedure i="13814" n="__pgi_uacc_upstart" v="0"/>
    <Procedure i="13816" n="__pgi_uacc_select_devid" v="0"/>
    <Procedure i="13818" n="__pgi_uacc_initialize" v="0"/>
    <Procedure i="13820" n="__pgi_uacc_enumerate" v="0"/>
    <Procedure i="13822" n="__pgi_uacc_init_device" v="0"/>
    <Procedure i="13824" n="__pgi_uacc_dataupa" v="0"/>
    <Procedure i="13826" n="__pgi_uacc_dataupx" v="0"/>
    <Procedure i="13828" n="__pgi_uacc_dataup1" v="0"/>
    <Procedure i="13830" n="__pgi_uacc_mirror_allocd" v="0"/>
    <Procedure i="13832" n="__pgi_uacc_alloc" v="0"/>
    <Procedure i="13834" n="__pgi_uacc_updone" v="0"/>
    <Procedure i="13836" n="__pgi_uacc_dataonb" v="0"/>
    <Procedure i="13838" n="__pgi_uacc_create" v="0"/>
    <Procedure i="13843" n="__pgi_uacc_dataoffb2" v="0"/>
    <Procedure i="13845" n="__pgi_uacc_datadownx" v="0"/>
    <Procedure i="13847" n="__pgi_uacc_datadown1" v="0"/>
    <Procedure i="13849" n="__pgi_uacc_computedone" v="0"/>
    <Procedure i="13851" n="__pgi_uacc_computedone2" v="0"/>
    <Procedure i="13853" n="__pgi_uacc_datadowna" v="0"/>
    <Procedure i="13841" n="do_create" v="0"/>
    <Procedure i="13857" n="__pgi_uacc_cuda_select_valid" v="0"/>
    <Procedure i="13859" n="__pgi_uacc_cuda_init_device" v="0"/>
    <Procedure i="13861" n="__pgi_uacc_cuda_init" v="0"/>
    <Procedure i="13863" n="__pgi_uacc_cuda_load_module" v="0"/>
    <Procedure i="13865" n="__pgi_uacc_cuda_load_this_module" v="0"/>
    <Procedure i="13867" n="__pgi_uacc_cuda_dataup1" v="0"/>
    <Procedure i="13869" n="__pgi_uacc_cuda_get_buffer" v="0"/>
    <Procedure i="13871" n="__pgi_uacc_cuda_alloc" v="0"/>
    <Procedure i="13873" n="__pgi_uacc_cuda_wait" v="0"/>
    <Procedure i="13875" n="__pgi_uacc_cuda_datadown1" v="0"/>
    <Procedure i="13877" n="__pgi_uacc_cuda_drain_down" v="0"/>
    <Procedure i="13881" n="__pgi_uacc_fill_buffer" v="0"/>
    <Procedure i="13883" n="__pgi_uacc_excontig_search" v="0"/>
    <Procedure i="13885" n="__pgi_uacc_move_buffer" v="0"/>
    <Procedure i="13889" n="pgf90_alloc04a_i8" v="0"/>
    <Procedure i="13892" n="__fort_gmalloc_without_abort" v="0"/>
    <Procedure i="13896" n="__c_mcopy8" v="0"/>
    <Procedure i="13900" n="__ioctl" v="0"/>
    <Procedure i="13902" n="_IO_new_fclose" v="0"/>
    <Procedure i="13904" n="_IO_new_file_close_it" v="0"/>
    <Procedure i="13906" n="__GI__IO_setb" v="0"/>
    <Procedure i="13908" n="syscall" v="0"/>
    <Procedure i="13910" n="fgets" v="0"/>
    <Procedure i="13912" n="__GI__IO_getline_info" v="0"/>
    <Procedure i="13914" n="__GI___uflow" v="0"/>
    <Procedure i="13916" n="__GI__IO_default_uflow" v="0"/>
    <Procedure i="13918" n="__GI__IO_file_underflow" v="0"/>
    <Procedure i="13920" n="__GI__IO_file_read" v="0"/>
    <Procedure i="13922" n="__read_nocancel" v="0"/>
    <Procedure i="13924" n="__memset_power8" v="0"/>
    <Procedure i="13926" n="__memcpy_power7" v="0"/>
    <Procedure i="13928" n="__GI__IO_file_close" v="0"/>
    <Procedure i="13930" n="__close_nocancel" v="0"/>
    <Procedure i="13932" n="__GI_strrchr" v="0"/>
    <Procedure i="13934" n="__GI_strchr" v="0"/>
    <Procedure i="13936" n="__realpath" v="0"/>
    <Procedure i="13938" n="__GI___lxstat64" v="0"/>
    <Procedure i="13940" n="__isoc99_fscanf" v="0"/>
    <Procedure i="13942" n="__GL__IO_vfscanf_internal__IO_vfscanf" v="0"/>
    <Procedure i="13944" n="__GI___strtoul_internal" v="0"/>
    <Procedure i="13946" n="__GI_____strtoull_l_internal" v="0"/>
    <Procedure i="13948" n="_xstat" v="0"/>
    <Procedure i="13950" n="__GI___libc_malloc" v="0"/>
    <Procedure i="13957" n="__GI___default_morecore" v="0"/>
    <Procedure i="13959" n="__GI___sbrk" v="0"/>
    <Procedure i="13961" n="__GI___clock_gettime" v="0"/>
    <Procedure i="13963" n="__munmap" v="0"/>
    <Procedure i="13953" n="_int_malloc" v="0"/>
    <Procedure i="13955" n="sysmalloc" v="0"/>
    <Procedure i="13978" n="opal_progress" v="0"/>
    <Procedure i="13982" n="mca_base_framework_close" v="0"/>
    <Procedure i="13984" n="mca_base_framework_components_close" v="0"/>
    <Procedure i="13986" n="mca_base_components_close" v="0"/>
    <Procedure i="13988" n="mca_base_component_close" v="0"/>
    <Procedure i="13976" n="intercept_munmap" v="0"/>
    <Procedure i="13980" n="intercept_brk" v="0"/>
    <Procedure i="14010" n="mca_pml_pami_progress" v="0"/>
    <Procedure i="14012" n="mca_pml_pami_send" v="0"/>
    <Procedure i="14016" n="PAMI_Context_advancev" v="0"/>
    <Procedure i="14018" n="PAMI::Device::IBV::Device::advance()" v="0"/>
    <Procedure i="14020" n="PAMI_Send_immediate" v="0"/>
    <Procedure i="14022" n="PAMI::Protocol::Send::Eager&lt;PAMI::Device::Shmem::PacketModel&lt;PAMI::Device::ShmemDevice&lt;PAMI::Fifo::WrapFifo&lt;PAMI::Fifo::FifoPacket&lt;64u, 4096u&gt;, PAMI::Counter::IndirectBounded&lt;PAMI::Atomic::NativeAtomic&gt;, 256u&gt;, PAMI::Counter::Indirect&lt;PAMI::Counter::Native&gt;, PAMI::Device::Shmem::CMAShaddr, 256u, 512u&gt; &gt;, PAMI::Device::IBV::PacketModel&lt;PAMI::Device::IBV::Device, false&gt; &gt;::EagerImpl&lt;(PAMI::Protocol::Send::configuration_t)5, true&gt;::immediate(pami_send_immediate_t*)" v="0"/>
    <Procedure i="14024" n="PAMI::Protocol::Send::EagerSimple&lt;PAMI::Device::Shmem::PacketModel&lt;PAMI::Device::ShmemDevice&lt;PAMI::Fifo::WrapFifo&lt;PAMI::Fifo::FifoPacket&lt;64u, 4096u&gt;, PAMI::Counter::IndirectBounded&lt;PAMI::Atomic::NativeAtomic&gt;, 256u&gt;, PAMI::Counter::Indirect&lt;PAMI::Counter::Native&gt;, PAMI::Device::Shmem::CMAShaddr, 256u, 512u&gt; &gt;, (PAMI::Protocol::Send::configuration_t)5&gt;::immediate_impl(pami_send_immediate_t*)" v="0"/>
    <Procedure i="14026" n="bool PAMI::Device::Interface::PacketModel&lt;PAMI::Device::Shmem::PacketModel&lt;PAMI::Device::ShmemDevice&lt;PAMI::Fifo::WrapFifo&lt;PAMI::Fifo::FifoPacket&lt;64u, 4096u&gt;, PAMI::Counter::IndirectBounded&lt;PAMI::Atomic::NativeAtomic&gt;, 256u&gt;, PAMI::Counter::Indirect&lt;PAMI::Counter::Native&gt;, PAMI::Device::Shmem::CMAShaddr, 256u, 512u&gt; &gt; &gt;::postPacket&lt;2u&gt;(unsigned long, unsigned long, void*, unsigned long, iovec (&amp;) [2u])" v="0"/>
    <Procedure i="14028" n="PAMI::Device::Shmem::Packet&lt;PAMI::Fifo::FifoPacket&lt;64u, 4096u&gt; &gt;::writePayload(PAMI::Fifo::FifoPacket&lt;64u, 4096u&gt;&amp;, iovec*, unsigned long)" v="0"/>
    <Procedure i="14030" n="PAMI_Context_destroyv" v="0"/>
    <Procedure i="14032" n="PAMI::Device::IBV::ResourceManager::finalizeDomain(IbvDomainInfo*)" v="0"/>
    <Procedure i="14036" n="ompi_common_pami_finalize" v="0"/>
    <Procedure i="14040" n="&lt;unknown procedure&gt; 0x12ca7 [libibverbs.so.1.0.0]" v="0"/>
    <Procedure i="14042" n="&lt;unknown procedure&gt; 0x9693 [libibverbs.so.1.0.0]" v="0"/>
    <Procedure i="14046" n="ibm_close" v="0"/>
    <Procedure i="14050" n="&lt;unknown procedure&gt; 0x3172b [libmlx5.so.1.0.0]" v="0"/>
    <Procedure i="14052" n="&lt;unknown procedure&gt; 0x31e03 [libmlx5.so.1.0.0]" v="0"/>
    <Procedure i="14054" n="&lt;unknown procedure&gt; 0x5780 [libmlx5.so.1.0.0]" v="0"/>
    <Procedure i="14056" n="&lt;unknown procedure&gt; 0x5acc [libmlx5.so.1.0.0]" v="0"/>
    <Procedure i="14058" n="&lt;unknown procedure&gt; 0x31680 [libmlx5.so.1.0.0]" v="0"/>
    <Procedure i="14060" n="&lt;unknown procedure&gt; 0x55ab3 [libmlx5.so.1.0.0]" v="0"/>
    <Procedure i="14062" n="&lt;unknown procedure&gt; 0x55e8b [libmlx5.so.1.0.0]" v="0"/>
    <Procedure i="14064" n="&lt;unknown procedure&gt; 0x77fb [libmlx5.so.1.0.0]" v="0"/>
    <Procedure i="14066" n="&lt;unknown procedure&gt; 0x7177 [libmlx5.so.1.0.0]" v="0"/>
    <Procedure i="14070" n="&lt;unknown procedure&gt; 0x2c4223 [libcuda.so.418.116.00]" v="0"/>
    <Procedure i="14072" n="&lt;unknown procedure&gt; 0xe5b4b [libcuda.so.418.116.00]" v="0"/>
    <Procedure i="14074" n="&lt;unknown procedure&gt; 0x1e766b [libcuda.so.418.116.00]" v="0"/>
    <Procedure i="14076" n="&lt;unknown procedure&gt; 0x16a870 [libcuda.so.418.116.00]" v="0"/>
    <Procedure i="14078" n="&lt;unknown procedure&gt; 0x1e31af [libcuda.so.418.116.00]" v="0"/>
    <Procedure i="14080" n="&lt;unknown procedure&gt; 0x395c63 [libcuda.so.418.116.00]" v="0"/>
    <Procedure i="14082" n="&lt;unknown procedure&gt; 0x42725b [libcuda.so.418.116.00]" v="0"/>
    <Procedure i="14084" n="&lt;unknown procedure&gt; 0x1e3af3 [libcuda.so.418.116.00]" v="0"/>
    <Procedure i="14086" n="&lt;unknown procedure&gt; 0x43c4df [libcuda.so.418.116.00]" v="0"/>
    <Procedure i="14088" n="&lt;unknown procedure&gt; 0x43b77b [libcuda.so.418.116.00]" v="0"/>
    <Procedure i="14090" n="&lt;unknown procedure&gt; 0x383b7f [libcuda.so.418.116.00]" v="0"/>
    <Procedure i="14092" n="&lt;unknown procedure&gt; 0x1e3b5f [libcuda.so.418.116.00]" v="0"/>
    <Procedure i="14094" n="&lt;unknown procedure&gt; 0x425f7b [libcuda.so.418.116.00]" v="0"/>
    <Procedure i="14096" n="&lt;unknown procedure&gt; 0x24b6e7 [libcuda.so.418.116.00]" v="0"/>
    <Procedure i="14098" n="&lt;unknown procedure&gt; 0x2469f3 [libcuda.so.418.116.00]" v="0"/>
    <Procedure i="14100" n="&lt;unknown procedure&gt; 0x3c3feb [libcuda.so.418.116.00]" v="0"/>
    <Procedure i="14102" n="&lt;unknown procedure&gt; 0x1e3bab [libcuda.so.418.116.00]" v="0"/>
    <Procedure i="14104" n="&lt;unknown procedure&gt; 0x443aeb [libcuda.so.418.116.00]" v="0"/>
    <Procedure i="14106" n="&lt;unknown procedure&gt; 0x43cfeb [libcuda.so.418.116.00]" v="0"/>
    <Procedure i="14108" n="&lt;unknown procedure&gt; 0x39388f [libcuda.so.418.116.00]" v="0"/>
    <Procedure i="14110" n="&lt;unknown procedure&gt; 0x257213 [libcuda.so.418.116.00]" v="0"/>
    <Procedure i="14112" n="&lt;unknown procedure&gt; 0x24a773 [libcuda.so.418.116.00]" v="0"/>
    <Procedure i="14114" n="&lt;unknown procedure&gt; 0x3c351f [libcuda.so.418.116.00]" v="0"/>
    <Procedure i="14116" n="&lt;unknown procedure&gt; 0x25ef33 [libcuda.so.418.116.00]" v="0"/>
    <Procedure i="14118" n="&lt;unknown procedure&gt; 0x25dbaf [libcuda.so.418.116.00]" v="0"/>
    <Procedure i="14120" n="&lt;unknown procedure&gt; 0x1e3c9f [libcuda.so.418.116.00]" v="0"/>
    <Procedure i="14122" n="&lt;unknown procedure&gt; 0x123bff [libcuda.so.418.116.00]" v="0"/>
    <Procedure i="14124" n="&lt;unknown procedure&gt; 0x11afbf [libcuda.so.418.116.00]" v="0"/>
    <Procedure i="14126" n="&lt;unknown procedure&gt; 0x11b09f [libcuda.so.418.116.00]" v="0"/>
    <Procedure i="14128" n="&lt;unknown procedure&gt; 0x415cab [libcuda.so.418.116.00]" v="0"/>
    <Procedure i="14130" n="&lt;unknown procedure&gt; 0x2f9dfb [libcuda.so.418.116.00]" v="0"/>
    <Procedure i="14132" n="&lt;unknown procedure&gt; 0x415d57 [libcuda.so.418.116.00]" v="0"/>
    <Procedure i="14134" n="&lt;unknown procedure&gt; 0x415f57 [libcuda.so.418.116.00]" v="0"/>
    <Procedure i="14136" n="&lt;unknown procedure&gt; 0x416187 [libcuda.so.418.116.00]" v="0"/>
    <Procedure i="14138" n="&lt;unknown procedure&gt; 0x4161cf [libcuda.so.418.116.00]" v="0"/>
    <Procedure i="14140" n="&lt;unknown procedure&gt; 0x41620f [libcuda.so.418.116.00]" v="0"/>
    <Procedure i="14142" n="&lt;unknown procedure&gt; 0x41649b [libcuda.so.418.116.00]" v="0"/>
    <Procedure i="14144" n="&lt;unknown procedure&gt; 0x11f2ff [libcuda.so.418.116.00]" v="0"/>
    <Procedure i="14146" n="&lt;unknown procedure&gt; 0x3ab16f [libcuda.so.418.116.00]" v="0"/>
    <Procedure i="14148" n="&lt;unknown procedure&gt; 0x26025b [libcuda.so.418.116.00]" v="0"/>
    <Procedure i="14150" n="&lt;unknown procedure&gt; 0x122e3f [libcuda.so.418.116.00]" v="0"/>
    <Procedure i="14152" n="&lt;unknown procedure&gt; 0x24ae47 [libcuda.so.418.116.00]" v="0"/>
    <Procedure i="14154" n="&lt;unknown procedure&gt; 0x246db3 [libcuda.so.418.116.00]" v="0"/>
    <Procedure i="14156" n="&lt;unknown procedure&gt; 0x3c097b [libcuda.so.418.116.00]" v="0"/>